{
  "schemaType": "partner",
  "recordStatus": "template",
  "partnerId": "partner-template-primary-party-rental",
  "partnerName": "TEMPLATE - Primary Party Rental Partner",
  "partnerType": "primary_party_rental_partner",
  "website": "https://example.com",
  "publicNameAllowed": false,
  "logoUseAllowed": false,
  "photoUseAllowed": false,
  "confirmedServices": [],
  "confirmedStates": [],
  "confirmedCities": [],
  "extendedStatesPossible": [],
  "extendedCitiesPossible": [],
  "requiresManualReviewOutsideCoreArea": true,
  "maxDeliveryRadiusMiles": null,
  "minimumEventSizeNotes": "TEMPLATE: Add confirmed minimum event or rental size notes after partner review.",
  "inventory": {
    "syntheticIceRink": false,
    "realIceRink": false,
    "portableRollerRink": false,
    "rinkSizes": [],
    "skatesAvailable": false,
    "staffAvailable": false,
    "barriersAvailable": false,
    "lightingAvailable": false,
    "brandingAvailable": false
  },
  "setupRequirements": {
    "indoor": false,
    "outdoor": false,
    "flatSurfaceRequired": true,
    "grassAllowed": false,
    "pavementAllowed": false,
    "powerRequired": false,
    "accessRequirements": "TEMPLATE: Replace with confirmed loading, access, surface, and power requirements."
  },
  "insurance": {
    "coiAvailable": false,
    "municipalEventSupport": false
  },
  "leadRouting": {
    "routeDirectlyIfCoreArea": false,
    "manualReviewIfOutsideArea": true,
    "preferredContactMethod": "manual_review",
    "responseExpectation": "TEMPLATE: Replace with confirmed partner response expectation."
  },
  "notes": "Template only. Do not treat this as a real partner claim until reviewed and confirmed.",
  "lastReviewed": ""
}
